<?xml version="1.0" encoding="UTF-8"?>
<classDefinitions lastModified="2009-12-23T12:12:12" xmlns="http://schemas.meijing.com.cn/mdbs/1/typeDefinitions" xmlns:xsi="http://www.w3.org/2001/XMLSchema-instance" xsi:schemaLocation="http://schemas.meijing.com.cn/mdbs/1/typeDefinitions typeDefinitions.xsd">
	<class name="Person" displayName="人员" >
		<property name="ID1" displayName="cc">
			<restriction base="integer">
				<defaultValue value="0" />
			</restriction>
		</property>
		<property name="Name" displayName="cc">
			<restriction base="string">
				<defaultValue value="mfk" />
				<minLength value="3" />
				<maxLength value="13" />
			</restriction>
		</property>
		<property name="Name2" displayName="cc">
			<restriction base="string">
				<defaultValue value="mfk" />
				<length value="3" />
			</restriction>
		</property>
		<property name="Age" displayName="cc">
			<restriction base="integer">
				<defaultValue value="123" />
				<minValue  value="3" />
				<maxValue value="313" />
			</restriction>
		</property>
		<property name="Day" displayName="cc">
			<restriction base="dateTime">
				<defaultValue value="2009-12-12 12:23:23" />
				<minValue value="2009-12-11 10:23:23" />
				<maxValue value="2009-12-13 12:23:23" />
			</restriction>
		</property>
		<property name="Mony" displayName="cc">
			<restriction base="decimal">
				<defaultValue value="1.3" />
				<minValue value="1.0" />
				<maxValue value="3.0" />
			</restriction>
		</property>
		<property name="IP" displayName="cc">
			<restriction base="ipAddress">
				<defaultValue value="12.12.12.12" />
			</restriction>
		</property>
		<property name="MAC" displayName="cc">
			<restriction base="physicalAddress">
				<defaultValue value="12-12-12-12-12-12" />
			</restriction>
		</property>
		<property name="Sex" displayName="cc">
			<restriction base="string">
				<enumeration>
					<value>male</value>
					<value>female</value>
				</enumeration>
				<defaultValue value="male" />
			</restriction>
		</property>
		<property name="Password" displayName="cc">
			<restriction base="password">
				<defaultValue value="mfk" />
			</restriction>
		</property>
	</class>
	<class name="Employee" displayName="雇员" base="Person">
		<property name="Job" displayName="cc">
				<restriction base="string">
					<defaultValue value="developer" />
				</restriction>
		</property>
	  <designFor></designFor>
	</class>	
	<designFor/>
</classDefinitions>
