<?xml version="1.0" encoding="UTF-8"?>
<mdbs:classDefinitions lastModified="2009-12-23T12:12:12" xmlns:mdbs="http://schemas.meijing.com.cn/mdbs/1/typeDefinitions" xmlns:xsi="http://www.w3.org/2001/XMLSchema-instance" xsi:schemaLocation="http://schemas.meijing.com.cn/mdbs/1/typeDefinitions typeDefinitions.xsd">
	<mdbs:class name="Person" displayName="äººå‘˜" >
		<mdbs:property name="Name" displayName="cc">
			<mdbs:restriction base="string">
				<mdbs:defaultValue>mf<mdbs:defaultValue>
				<mdbs:minLength>3</mdbs:minLength>
				<mdbs:maxLength>13</mdbs:maxLength>
			</mdbs:restriction>
		</mdbs:property>
	</mdbs:class>		
</mdbs:classDefinitions>